{
  "schema_version": "model-skyline/v1alpha1",
  "kind": "frontier-history",
  "frontier_id": "cost-per-solved-vs-solve-rate",
  "entries": [
    {
      "snapshot_id": "7f9ac32d3458c3e6ea92a37de3e1798c15de3f8576a0b1e99c754959ce4aef02",
      "generated_at": "2026-08-30T20:06:03.032248Z",
      "workload": {
        "id": "aider-polyglot",
        "version": "cb6a152e5ee27fbc77ac499d5e628ccd74a5fa2a",
        "unit": "polyglot_case"
      },
      "config_hash": "10b14e3fc6b94b4ec276d7a420354105ec161bc1392f4e5eb93be440374f6d7a",
      "catalog_hash": "0fe5d1ad120ac1eda1e26580ccb1ef678f7438b996bda89eb5952ba66644a599",
      "axis_hash": "8e416307ec3a3f84c878c5c1a0802d06d02a04ebdf6b381647bb76f7894656a6",
      "view_hash": "e302ad4f1366c8e2e4cc25e00056fed269b282d755d46a87ea82540fe23487c0",
      "snapshot": {
        "path": "frontiers/cost-per-solved-vs-solve-rate/7f9ac32d3458c3e6ea92a37de3e1798c15de3f8576a0b1e99c754959ce4aef02.json",
        "sha256": "0665465d54f566fd2d8c6e240616031fd9c61647090e4fce883d73fddbecc766",
        "media_type": "application/json"
      }
    },
    {
      "snapshot_id": "d91050fcd5bf9004329d62b54b791a671febc57f90dce2bcacaeace47963f454",
      "generated_at": "2026-08-30T19:50:53.186275Z",
      "workload": {
        "id": "aider-polyglot",
        "version": "cb6a152e5ee27fbc77ac499d5e628ccd74a5fa2a",
        "unit": "polyglot_case"
      },
      "config_hash": "81294b6bfb1d9e848f1dcf000472f7023d4664deadb0a19cdfda31130067c915",
      "catalog_hash": "06a10bf220a45d8e531cddb0eae638ea779f5091666b4f36a438086c37f8d845",
      "axis_hash": "8e416307ec3a3f84c878c5c1a0802d06d02a04ebdf6b381647bb76f7894656a6",
      "view_hash": "e302ad4f1366c8e2e4cc25e00056fed269b282d755d46a87ea82540fe23487c0",
      "snapshot": {
        "path": "frontiers/cost-per-solved-vs-solve-rate/d91050fcd5bf9004329d62b54b791a671febc57f90dce2bcacaeace47963f454.json",
        "sha256": "8b72a102dfc4bc6e5931bf4a214ffec2cb219c8b472056d022b955fae5b4cf38",
        "media_type": "application/json"
      }
    },
    {
      "snapshot_id": "92d13241b6c91bece61dbfad357b1f3c8976e58b380a3203dee8264f7deb1567",
      "generated_at": "2026-08-30T19:43:34.685832Z",
      "workload": {
        "id": "aider-polyglot",
        "version": "cb6a152e5ee27fbc77ac499d5e628ccd74a5fa2a",
        "unit": "polyglot_case"
      },
      "config_hash": "637d9119de527763b10fe5b859bb6a28289b6165c3f076bc34a7c592c3fd414f",
      "catalog_hash": "a6804744e2f3172e3f6b8dc9af10687d91f87ce866361811bf23bc075b7d2dd2",
      "axis_hash": "8e416307ec3a3f84c878c5c1a0802d06d02a04ebdf6b381647bb76f7894656a6",
      "view_hash": "e302ad4f1366c8e2e4cc25e00056fed269b282d755d46a87ea82540fe23487c0",
      "snapshot": {
        "path": "frontiers/cost-per-solved-vs-solve-rate/92d13241b6c91bece61dbfad357b1f3c8976e58b380a3203dee8264f7deb1567.json",
        "sha256": "ae512a0a07871f169a23f0c5db7f16582119f3ad12977e3884c5894e2b3598f4",
        "media_type": "application/json"
      }
    }
  ]
}
