{
  "schema_version": "model-skyline/v1alpha1",
  "kind": "frontier-history",
  "frontier_id": "price-snapshot-reconstructed-token-cost-vs-solve-rate",
  "entries": [
    {
      "snapshot_id": "23028628528fbbefcb9d95ca1953fe29b02c501587dcc9f2a58af74b4704e385",
      "generated_at": "2026-09-08T12:09:12.209180Z",
      "workload": {
        "id": "aider-polyglot",
        "version": "sha256:bb92c4555c1341c52f386c8c8b1ba7c5b3c56cec60a5f9129ecf8ee99a8cc2a8",
        "unit": "polyglot_case"
      },
      "config_hash": "f2f420537eba812f9ebc11b5824555c28b8127d8bddb7ab5062099c1bb3a5a2d",
      "catalog_hash": "066c7c56ca4634e794e16c23e3216c14d74f49a00b1ee53e7e90c51a35031a0b",
      "axis_hash": "d3b0637eb3c85e13ddb86a737ccbb3715dc3a8c666d08921b9ef8ff6287c57cd",
      "view_hash": "7a65673d671b271e4ffb72d6fbdb11c4c595b9a19be299766240c0f751828f9a",
      "snapshot": {
        "path": "frontiers/price-snapshot-reconstructed-token-cost-vs-solve-rate/23028628528fbbefcb9d95ca1953fe29b02c501587dcc9f2a58af74b4704e385.json",
        "sha256": "9ddc06b69e92ec17d37b8c2541d90c0453b9b6e70e96df2ed650877512bebc21",
        "media_type": "application/json"
      }
    },
    {
      "snapshot_id": "83bc7c138d7098bcb580fc693ddd0a882b1645c9cdfb24028560ceda2fd14105",
      "generated_at": "2026-09-07T13:30:49.853780Z",
      "workload": {
        "id": "aider-polyglot",
        "version": "sha256:bb92c4555c1341c52f386c8c8b1ba7c5b3c56cec60a5f9129ecf8ee99a8cc2a8",
        "unit": "polyglot_case"
      },
      "config_hash": "f2f420537eba812f9ebc11b5824555c28b8127d8bddb7ab5062099c1bb3a5a2d",
      "catalog_hash": "b15c19b19ba7c3daba4b0e2a54c5e4c10551fd5c41461036230b9b8875628a2b",
      "axis_hash": "d3b0637eb3c85e13ddb86a737ccbb3715dc3a8c666d08921b9ef8ff6287c57cd",
      "view_hash": "7a65673d671b271e4ffb72d6fbdb11c4c595b9a19be299766240c0f751828f9a",
      "snapshot": {
        "path": "frontiers/price-snapshot-reconstructed-token-cost-vs-solve-rate/83bc7c138d7098bcb580fc693ddd0a882b1645c9cdfb24028560ceda2fd14105.json",
        "sha256": "8823c8c7405e4beef3990e89c20675fd98deb373892e6939b1bcf51b280f2bc8",
        "media_type": "application/json"
      }
    },
    {
      "snapshot_id": "60f2a1f6a3ea14796ae97fc9d8fcd24305d0c2d6c5f63b25884c22df6e3459d3",
      "generated_at": "2026-09-06T11:39:15.282780Z",
      "workload": {
        "id": "aider-polyglot",
        "version": "sha256:bb92c4555c1341c52f386c8c8b1ba7c5b3c56cec60a5f9129ecf8ee99a8cc2a8",
        "unit": "polyglot_case"
      },
      "config_hash": "f2f420537eba812f9ebc11b5824555c28b8127d8bddb7ab5062099c1bb3a5a2d",
      "catalog_hash": "d66daf7a5b63cde52e7bbec223cb6afa9aa33889c3567e2b80f1ef07aff7de16",
      "axis_hash": "d3b0637eb3c85e13ddb86a737ccbb3715dc3a8c666d08921b9ef8ff6287c57cd",
      "view_hash": "7a65673d671b271e4ffb72d6fbdb11c4c595b9a19be299766240c0f751828f9a",
      "snapshot": {
        "path": "frontiers/price-snapshot-reconstructed-token-cost-vs-solve-rate/60f2a1f6a3ea14796ae97fc9d8fcd24305d0c2d6c5f63b25884c22df6e3459d3.json",
        "sha256": "e6911980323fe97c8664af71a6f888b880eed21bce3d0a11d03de125e818a7e0",
        "media_type": "application/json"
      }
    },
    {
      "snapshot_id": "73b5c1a57993a4032d4fcaacf74205803f43e86951c7457e4b118ea0f8ed3396",
      "generated_at": "2026-09-05T11:16:43.631127Z",
      "workload": {
        "id": "aider-polyglot",
        "version": "sha256:bb92c4555c1341c52f386c8c8b1ba7c5b3c56cec60a5f9129ecf8ee99a8cc2a8",
        "unit": "polyglot_case"
      },
      "config_hash": "f2f420537eba812f9ebc11b5824555c28b8127d8bddb7ab5062099c1bb3a5a2d",
      "catalog_hash": "064a86fd9fa20af600470377b79a67a614afb272c7dcd642a1006fd700411714",
      "axis_hash": "d3b0637eb3c85e13ddb86a737ccbb3715dc3a8c666d08921b9ef8ff6287c57cd",
      "view_hash": "7a65673d671b271e4ffb72d6fbdb11c4c595b9a19be299766240c0f751828f9a",
      "snapshot": {
        "path": "frontiers/price-snapshot-reconstructed-token-cost-vs-solve-rate/73b5c1a57993a4032d4fcaacf74205803f43e86951c7457e4b118ea0f8ed3396.json",
        "sha256": "1aefa16df544cdedde6034c0e83d5b89531cee181c30475741775b26e891e49c",
        "media_type": "application/json"
      }
    },
    {
      "snapshot_id": "1916c20fe80a72f9b46966189c45dbb86f47087b0921039b328872b1df45e207",
      "generated_at": "2026-09-04T12:08:15.072031Z",
      "workload": {
        "id": "aider-polyglot",
        "version": "sha256:bb92c4555c1341c52f386c8c8b1ba7c5b3c56cec60a5f9129ecf8ee99a8cc2a8",
        "unit": "polyglot_case"
      },
      "config_hash": "f2f420537eba812f9ebc11b5824555c28b8127d8bddb7ab5062099c1bb3a5a2d",
      "catalog_hash": "b3551e91d3a3ea22062ec9b46f3439fc2384e8d7b65176a2ca0c50209893f8dd",
      "axis_hash": "d3b0637eb3c85e13ddb86a737ccbb3715dc3a8c666d08921b9ef8ff6287c57cd",
      "view_hash": "7a65673d671b271e4ffb72d6fbdb11c4c595b9a19be299766240c0f751828f9a",
      "snapshot": {
        "path": "frontiers/price-snapshot-reconstructed-token-cost-vs-solve-rate/1916c20fe80a72f9b46966189c45dbb86f47087b0921039b328872b1df45e207.json",
        "sha256": "d415232a704db944a8c5129b779ee963e0907441a73957992d48d97d1e24ff29",
        "media_type": "application/json"
      }
    },
    {
      "snapshot_id": "26dece9d6fa87ac5875a041fc82da5385b8a8b7da037c50a80aa46ec3f6d4f0b",
      "generated_at": "2026-09-03T12:06:31.410504Z",
      "workload": {
        "id": "aider-polyglot",
        "version": "sha256:bb92c4555c1341c52f386c8c8b1ba7c5b3c56cec60a5f9129ecf8ee99a8cc2a8",
        "unit": "polyglot_case"
      },
      "config_hash": "f2f420537eba812f9ebc11b5824555c28b8127d8bddb7ab5062099c1bb3a5a2d",
      "catalog_hash": "3c135f91ecb602f4c790ab27f73f4aa77744451db74f962985ade48513bf915f",
      "axis_hash": "d3b0637eb3c85e13ddb86a737ccbb3715dc3a8c666d08921b9ef8ff6287c57cd",
      "view_hash": "7a65673d671b271e4ffb72d6fbdb11c4c595b9a19be299766240c0f751828f9a",
      "snapshot": {
        "path": "frontiers/price-snapshot-reconstructed-token-cost-vs-solve-rate/26dece9d6fa87ac5875a041fc82da5385b8a8b7da037c50a80aa46ec3f6d4f0b.json",
        "sha256": "fe2715ce9afd5204ceadd811a66b184471558f34aa0c55bcb21499317700a2cd",
        "media_type": "application/json"
      }
    },
    {
      "snapshot_id": "a79eac976eb5983d44e1ee90f048cc7d0f9b6fc855a6c5d620a7cf1a7ef7a252",
      "generated_at": "2026-09-02T12:07:07.694249Z",
      "workload": {
        "id": "aider-polyglot",
        "version": "sha256:bb92c4555c1341c52f386c8c8b1ba7c5b3c56cec60a5f9129ecf8ee99a8cc2a8",
        "unit": "polyglot_case"
      },
      "config_hash": "f2f420537eba812f9ebc11b5824555c28b8127d8bddb7ab5062099c1bb3a5a2d",
      "catalog_hash": "3db39522a6d60e42dae1472b351f8b166693a03f475c08e5ba0e349fd60717ee",
      "axis_hash": "d3b0637eb3c85e13ddb86a737ccbb3715dc3a8c666d08921b9ef8ff6287c57cd",
      "view_hash": "7a65673d671b271e4ffb72d6fbdb11c4c595b9a19be299766240c0f751828f9a",
      "snapshot": {
        "path": "frontiers/price-snapshot-reconstructed-token-cost-vs-solve-rate/a79eac976eb5983d44e1ee90f048cc7d0f9b6fc855a6c5d620a7cf1a7ef7a252.json",
        "sha256": "9805f993032abe9990b984b9a383d91e004484e88769ffa2c92be2b029149454",
        "media_type": "application/json"
      }
    },
    {
      "snapshot_id": "c36abc4c7edd29bc18d812036d3642c616bad3a8e67843ae3671bde476cd7542",
      "generated_at": "2026-09-01T12:34:54.105610Z",
      "workload": {
        "id": "aider-polyglot",
        "version": "sha256:bb92c4555c1341c52f386c8c8b1ba7c5b3c56cec60a5f9129ecf8ee99a8cc2a8",
        "unit": "polyglot_case"
      },
      "config_hash": "f2f420537eba812f9ebc11b5824555c28b8127d8bddb7ab5062099c1bb3a5a2d",
      "catalog_hash": "b5c78df0ed799f0ea9f1f1a2c59e2045a5750029da835ee6ba174c1904e7ffc7",
      "axis_hash": "d3b0637eb3c85e13ddb86a737ccbb3715dc3a8c666d08921b9ef8ff6287c57cd",
      "view_hash": "7a65673d671b271e4ffb72d6fbdb11c4c595b9a19be299766240c0f751828f9a",
      "snapshot": {
        "path": "frontiers/price-snapshot-reconstructed-token-cost-vs-solve-rate/c36abc4c7edd29bc18d812036d3642c616bad3a8e67843ae3671bde476cd7542.json",
        "sha256": "5da445dabcd7b48113af8a42cc300c0c5e3b85e3f7a08814d92cb46909635d19",
        "media_type": "application/json"
      }
    },
    {
      "snapshot_id": "8975c1a961f34413fe2675b58ef0d474f1965a1ad284939698da04cb3f0fe3ec",
      "generated_at": "2026-09-01T10:10:34.978754Z",
      "workload": {
        "id": "aider-polyglot",
        "version": "sha256:bb92c4555c1341c52f386c8c8b1ba7c5b3c56cec60a5f9129ecf8ee99a8cc2a8",
        "unit": "polyglot_case"
      },
      "config_hash": "f2f420537eba812f9ebc11b5824555c28b8127d8bddb7ab5062099c1bb3a5a2d",
      "catalog_hash": "3551a844f5292c228a58a72ad9c238e36347f45a7d49d0910f6e4c0484f3a2f5",
      "axis_hash": "d3b0637eb3c85e13ddb86a737ccbb3715dc3a8c666d08921b9ef8ff6287c57cd",
      "view_hash": "7a65673d671b271e4ffb72d6fbdb11c4c595b9a19be299766240c0f751828f9a",
      "snapshot": {
        "path": "frontiers/price-snapshot-reconstructed-token-cost-vs-solve-rate/8975c1a961f34413fe2675b58ef0d474f1965a1ad284939698da04cb3f0fe3ec.json",
        "sha256": "ef78a73acd8d9ddd952167034a8bc86e9e34765cad68616087a4332fc9f56d37",
        "media_type": "application/json"
      }
    }
  ]
}
