{
  "schema_version": "model-skyline/v1alpha1",
  "kind": "frontier-history",
  "frontier_id": "price-snapshot-cost-per-solved-vs-solve-rate",
  "entries": [
    {
      "snapshot_id": "5bd62e03d07ded4c8f442be3c19635a09efa6929137f57cba1bde3ce883b62a5",
      "generated_at": "2026-09-04T12:08:15.072031Z",
      "workload": {
        "id": "aider-polyglot",
        "version": "sha256:bb92c4555c1341c52f386c8c8b1ba7c5b3c56cec60a5f9129ecf8ee99a8cc2a8",
        "unit": "polyglot_case"
      },
      "config_hash": "0583e3aa707c6ecb9be4743310f0ef6018bed3e2ac544e002c8fd4eec4a03b51",
      "catalog_hash": "b3551e91d3a3ea22062ec9b46f3439fc2384e8d7b65176a2ca0c50209893f8dd",
      "axis_hash": "5588ea40bd4a0d277034e8a164848ca1c6b7d96988ab30d846445cf77a71ff86",
      "view_hash": "bda08f4466c112a38bd3d130ca09f482e486533e6a89597325ffd8b2cf9af40b",
      "snapshot": {
        "path": "frontiers/price-snapshot-cost-per-solved-vs-solve-rate/5bd62e03d07ded4c8f442be3c19635a09efa6929137f57cba1bde3ce883b62a5.json",
        "sha256": "c18381015fef190d23f671cf3b0674485bd1225e7b47d5627fca37f113e1f519",
        "media_type": "application/json"
      }
    },
    {
      "snapshot_id": "53c420004bb3d7c473098b6c7bafdc305845ed163983308d3cd9e35d500f4196",
      "generated_at": "2026-09-03T12:06:31.410504Z",
      "workload": {
        "id": "aider-polyglot",
        "version": "sha256:bb92c4555c1341c52f386c8c8b1ba7c5b3c56cec60a5f9129ecf8ee99a8cc2a8",
        "unit": "polyglot_case"
      },
      "config_hash": "0583e3aa707c6ecb9be4743310f0ef6018bed3e2ac544e002c8fd4eec4a03b51",
      "catalog_hash": "3c135f91ecb602f4c790ab27f73f4aa77744451db74f962985ade48513bf915f",
      "axis_hash": "5588ea40bd4a0d277034e8a164848ca1c6b7d96988ab30d846445cf77a71ff86",
      "view_hash": "bda08f4466c112a38bd3d130ca09f482e486533e6a89597325ffd8b2cf9af40b",
      "snapshot": {
        "path": "frontiers/price-snapshot-cost-per-solved-vs-solve-rate/53c420004bb3d7c473098b6c7bafdc305845ed163983308d3cd9e35d500f4196.json",
        "sha256": "1b6b330bae705cf1d0980d09400ee9c41d398262b5c3bce79e8b7988f6535185",
        "media_type": "application/json"
      }
    },
    {
      "snapshot_id": "e33e03215b8a66351c97e8a86ae58ce25110f06df26e3d8b16de509938070825",
      "generated_at": "2026-09-02T12:07:07.694249Z",
      "workload": {
        "id": "aider-polyglot",
        "version": "sha256:bb92c4555c1341c52f386c8c8b1ba7c5b3c56cec60a5f9129ecf8ee99a8cc2a8",
        "unit": "polyglot_case"
      },
      "config_hash": "0583e3aa707c6ecb9be4743310f0ef6018bed3e2ac544e002c8fd4eec4a03b51",
      "catalog_hash": "3db39522a6d60e42dae1472b351f8b166693a03f475c08e5ba0e349fd60717ee",
      "axis_hash": "5588ea40bd4a0d277034e8a164848ca1c6b7d96988ab30d846445cf77a71ff86",
      "view_hash": "bda08f4466c112a38bd3d130ca09f482e486533e6a89597325ffd8b2cf9af40b",
      "snapshot": {
        "path": "frontiers/price-snapshot-cost-per-solved-vs-solve-rate/e33e03215b8a66351c97e8a86ae58ce25110f06df26e3d8b16de509938070825.json",
        "sha256": "619932c0579ad48469d9df1094df31b1c995a4d2e8f93e4b88f14f4f7488df56",
        "media_type": "application/json"
      }
    },
    {
      "snapshot_id": "1d42e616800ff02ceddb45b13686f58f5651721e50528906ff7667facf5f8d7a",
      "generated_at": "2026-09-01T12:34:54.105610Z",
      "workload": {
        "id": "aider-polyglot",
        "version": "sha256:bb92c4555c1341c52f386c8c8b1ba7c5b3c56cec60a5f9129ecf8ee99a8cc2a8",
        "unit": "polyglot_case"
      },
      "config_hash": "0583e3aa707c6ecb9be4743310f0ef6018bed3e2ac544e002c8fd4eec4a03b51",
      "catalog_hash": "b5c78df0ed799f0ea9f1f1a2c59e2045a5750029da835ee6ba174c1904e7ffc7",
      "axis_hash": "5588ea40bd4a0d277034e8a164848ca1c6b7d96988ab30d846445cf77a71ff86",
      "view_hash": "bda08f4466c112a38bd3d130ca09f482e486533e6a89597325ffd8b2cf9af40b",
      "snapshot": {
        "path": "frontiers/price-snapshot-cost-per-solved-vs-solve-rate/1d42e616800ff02ceddb45b13686f58f5651721e50528906ff7667facf5f8d7a.json",
        "sha256": "e2a0cd6a82651fed54b9270b4468d65ff947741f4fb556464bc6be3d6e9f68cd",
        "media_type": "application/json"
      }
    },
    {
      "snapshot_id": "82d901eb3658ad5540dcf1a1c12f90b58b7ad35a03478f4bbfadc39b7134f3e2",
      "generated_at": "2026-09-01T10:10:34.978754Z",
      "workload": {
        "id": "aider-polyglot",
        "version": "sha256:bb92c4555c1341c52f386c8c8b1ba7c5b3c56cec60a5f9129ecf8ee99a8cc2a8",
        "unit": "polyglot_case"
      },
      "config_hash": "0583e3aa707c6ecb9be4743310f0ef6018bed3e2ac544e002c8fd4eec4a03b51",
      "catalog_hash": "3551a844f5292c228a58a72ad9c238e36347f45a7d49d0910f6e4c0484f3a2f5",
      "axis_hash": "5588ea40bd4a0d277034e8a164848ca1c6b7d96988ab30d846445cf77a71ff86",
      "view_hash": "bda08f4466c112a38bd3d130ca09f482e486533e6a89597325ffd8b2cf9af40b",
      "snapshot": {
        "path": "frontiers/price-snapshot-cost-per-solved-vs-solve-rate/82d901eb3658ad5540dcf1a1c12f90b58b7ad35a03478f4bbfadc39b7134f3e2.json",
        "sha256": "e1f1851a437a5c4178927b071d13a957c02aff5785762ed9daa74aa3d86a547e",
        "media_type": "application/json"
      }
    }
  ]
}
