{
  "schema_version": "model-skyline/v1alpha1",
  "kind": "frontier-history",
  "frontier_id": "price-snapshot-reconstructed-token-cost-vs-solve-rate",
  "entries": [
    {
      "snapshot_id": "65962428dde2566529cd47d0aa632b6517c74d72e17b9fa7d3d43a8b7c826775",
      "generated_at": "2026-09-01T09:19:10.490121Z",
      "workload": {
        "id": "aider-polyglot",
        "version": "sha256:baa026c95992c1cec4650d1396b4046d10bc957966846f0bdfcee142e9748858",
        "unit": "polyglot_case"
      },
      "config_hash": "e921204a241b405f565c824fe96d876ef262953b7dc70a58c68801b33b55ba48",
      "catalog_hash": "86826023b62c3911bdc6f40d6f82c54394d3905d21def94936a95df9fd58c826",
      "axis_hash": "1d15d21a83ec5019fb62f87cfbd76bae3bd1a4da37add7773c39a4d94d582ab5",
      "view_hash": "7a65673d671b271e4ffb72d6fbdb11c4c595b9a19be299766240c0f751828f9a",
      "snapshot": {
        "path": "frontiers/price-snapshot-reconstructed-token-cost-vs-solve-rate/65962428dde2566529cd47d0aa632b6517c74d72e17b9fa7d3d43a8b7c826775.json",
        "sha256": "9958612101e9f7a90774de087064975f4ec509e06dab3fec0fd17737a240162f",
        "media_type": "application/json"
      }
    },
    {
      "snapshot_id": "43f348fb7198db130442485d7697aa8c314b7bfbbdf1aa641783b001a7cd8106",
      "generated_at": "2026-09-01T08:31:23.963179Z",
      "workload": {
        "id": "aider-polyglot",
        "version": "sha256:baa026c95992c1cec4650d1396b4046d10bc957966846f0bdfcee142e9748858",
        "unit": "polyglot_case"
      },
      "config_hash": "e921204a241b405f565c824fe96d876ef262953b7dc70a58c68801b33b55ba48",
      "catalog_hash": "3f20a3e0778b6bd21735c6bda208b7a27851724edf8e9ee6adaf60bd32fa4d5f",
      "axis_hash": "1d15d21a83ec5019fb62f87cfbd76bae3bd1a4da37add7773c39a4d94d582ab5",
      "view_hash": "7a65673d671b271e4ffb72d6fbdb11c4c595b9a19be299766240c0f751828f9a",
      "snapshot": {
        "path": "frontiers/price-snapshot-reconstructed-token-cost-vs-solve-rate/43f348fb7198db130442485d7697aa8c314b7bfbbdf1aa641783b001a7cd8106.json",
        "sha256": "63d20654aca14a2f2e731592148f656f8bcf9a2f8fa08a7cc582c170ee378a33",
        "media_type": "application/json"
      }
    },
    {
      "snapshot_id": "d9dafadfd0565eb09f10b2a7755da0dc14beeed6662bd22f99c1c62ebe03009d",
      "generated_at": "2026-09-01T05:48:07.916412Z",
      "workload": {
        "id": "aider-polyglot",
        "version": "sha256:baa026c95992c1cec4650d1396b4046d10bc957966846f0bdfcee142e9748858",
        "unit": "polyglot_case"
      },
      "config_hash": "e921204a241b405f565c824fe96d876ef262953b7dc70a58c68801b33b55ba48",
      "catalog_hash": "c1e143005d219a311760696b124e8c0c20c6794e08570701ff8755654923d6e7",
      "axis_hash": "1d15d21a83ec5019fb62f87cfbd76bae3bd1a4da37add7773c39a4d94d582ab5",
      "view_hash": "7a65673d671b271e4ffb72d6fbdb11c4c595b9a19be299766240c0f751828f9a",
      "snapshot": {
        "path": "frontiers/price-snapshot-reconstructed-token-cost-vs-solve-rate/d9dafadfd0565eb09f10b2a7755da0dc14beeed6662bd22f99c1c62ebe03009d.json",
        "sha256": "5b145e2cce407fa3907f55f15dde582d211ba136585146209fb58894482045e6",
        "media_type": "application/json"
      }
    },
    {
      "snapshot_id": "65ee6cc74cf5e41c90b34ea1e1f06276855645fbe12de31021ea72d036e49ce5",
      "generated_at": "2026-08-31T17:39:32.252618Z",
      "workload": {
        "id": "aider-polyglot",
        "version": "sha256:baa026c95992c1cec4650d1396b4046d10bc957966846f0bdfcee142e9748858",
        "unit": "polyglot_case"
      },
      "config_hash": "e921204a241b405f565c824fe96d876ef262953b7dc70a58c68801b33b55ba48",
      "catalog_hash": "7468560b3088e52d423c8d3d4b47617724110bd1771821d5988c0f9068c6e7c9",
      "axis_hash": "1d15d21a83ec5019fb62f87cfbd76bae3bd1a4da37add7773c39a4d94d582ab5",
      "view_hash": "7a65673d671b271e4ffb72d6fbdb11c4c595b9a19be299766240c0f751828f9a",
      "snapshot": {
        "path": "frontiers/price-snapshot-reconstructed-token-cost-vs-solve-rate/65ee6cc74cf5e41c90b34ea1e1f06276855645fbe12de31021ea72d036e49ce5.json",
        "sha256": "e6360019986cb694f6bc48aecdf1a16eb2289a57c4ce89998a58f8c45ceca0a4",
        "media_type": "application/json"
      }
    }
  ]
}
