{
  "schema_version": "model-skyline/v1alpha1",
  "kind": "frontier-history",
  "frontier_id": "price-snapshot-cost-per-solved-vs-solve-rate",
  "entries": [
    {
      "snapshot_id": "1d42e616800ff02ceddb45b13686f58f5651721e50528906ff7667facf5f8d7a",
      "generated_at": "2026-09-01T12:34:54.105610Z",
      "workload": {
        "id": "aider-polyglot",
        "version": "sha256:bb92c4555c1341c52f386c8c8b1ba7c5b3c56cec60a5f9129ecf8ee99a8cc2a8",
        "unit": "polyglot_case"
      },
      "config_hash": "0583e3aa707c6ecb9be4743310f0ef6018bed3e2ac544e002c8fd4eec4a03b51",
      "catalog_hash": "b5c78df0ed799f0ea9f1f1a2c59e2045a5750029da835ee6ba174c1904e7ffc7",
      "axis_hash": "5588ea40bd4a0d277034e8a164848ca1c6b7d96988ab30d846445cf77a71ff86",
      "view_hash": "bda08f4466c112a38bd3d130ca09f482e486533e6a89597325ffd8b2cf9af40b",
      "snapshot": {
        "path": "frontiers/price-snapshot-cost-per-solved-vs-solve-rate/1d42e616800ff02ceddb45b13686f58f5651721e50528906ff7667facf5f8d7a.json",
        "sha256": "e2a0cd6a82651fed54b9270b4468d65ff947741f4fb556464bc6be3d6e9f68cd",
        "media_type": "application/json"
      }
    },
    {
      "snapshot_id": "82d901eb3658ad5540dcf1a1c12f90b58b7ad35a03478f4bbfadc39b7134f3e2",
      "generated_at": "2026-09-01T10:10:34.978754Z",
      "workload": {
        "id": "aider-polyglot",
        "version": "sha256:bb92c4555c1341c52f386c8c8b1ba7c5b3c56cec60a5f9129ecf8ee99a8cc2a8",
        "unit": "polyglot_case"
      },
      "config_hash": "0583e3aa707c6ecb9be4743310f0ef6018bed3e2ac544e002c8fd4eec4a03b51",
      "catalog_hash": "3551a844f5292c228a58a72ad9c238e36347f45a7d49d0910f6e4c0484f3a2f5",
      "axis_hash": "5588ea40bd4a0d277034e8a164848ca1c6b7d96988ab30d846445cf77a71ff86",
      "view_hash": "bda08f4466c112a38bd3d130ca09f482e486533e6a89597325ffd8b2cf9af40b",
      "snapshot": {
        "path": "frontiers/price-snapshot-cost-per-solved-vs-solve-rate/82d901eb3658ad5540dcf1a1c12f90b58b7ad35a03478f4bbfadc39b7134f3e2.json",
        "sha256": "e1f1851a437a5c4178927b071d13a957c02aff5785762ed9daa74aa3d86a547e",
        "media_type": "application/json"
      }
    }
  ]
}
