{
  "schema_version": "model-skyline/v1alpha1",
  "kind": "frontier-history",
  "frontier_id": "total-cost-vs-solve-rate",
  "entries": [
    {
      "snapshot_id": "8634800aed07463d7a52eb3da9dcc00f3445bb048ce2c5226eee1dda48a7e455",
      "generated_at": "2026-09-28T14:26:07.425182Z",
      "workload": {
        "id": "aider-polyglot",
        "version": "cb6a152e5ee27fbc77ac499d5e628ccd74a5fa2a",
        "unit": "polyglot_case"
      },
      "config_hash": "7b3ff2c4f66ac84753c961056c6f8917b15835c79edcd2f43f49f89dbb2f6699",
      "catalog_hash": "41ff7f2484a35bf8d534efe8e7eb615dfb330cd948bb066d50684baff13c8967",
      "axis_hash": "ec2d64c575c9deda9612834010ee200271e725ca6ee0114f6d5e068efcc5d254",
      "view_hash": "437cb850f8b421392fb44219fd13427d1ebe874fe1d96321f3e4401174bc134f",
      "snapshot": {
        "path": "frontiers/total-cost-vs-solve-rate/8634800aed07463d7a52eb3da9dcc00f3445bb048ce2c5226eee1dda48a7e455.json",
        "sha256": "5f83e8322e077ed8bd8c71c230d98fadce42d6d4ca85c97c763b08767bb3b855",
        "media_type": "application/json"
      }
    },
    {
      "snapshot_id": "9aa9dc11d48727ad97adcafb3e0e94cf58644402d8661f1fcc68b44a69e7405a",
      "generated_at": "2026-09-21T13:18:32.410251Z",
      "workload": {
        "id": "aider-polyglot",
        "version": "cb6a152e5ee27fbc77ac499d5e628ccd74a5fa2a",
        "unit": "polyglot_case"
      },
      "config_hash": "7b3ff2c4f66ac84753c961056c6f8917b15835c79edcd2f43f49f89dbb2f6699",
      "catalog_hash": "8ec71d8b1b1d84140dc95638d0356237ce2108a0a32629f61dcef7e936c14eea",
      "axis_hash": "ec2d64c575c9deda9612834010ee200271e725ca6ee0114f6d5e068efcc5d254",
      "view_hash": "437cb850f8b421392fb44219fd13427d1ebe874fe1d96321f3e4401174bc134f",
      "snapshot": {
        "path": "frontiers/total-cost-vs-solve-rate/9aa9dc11d48727ad97adcafb3e0e94cf58644402d8661f1fcc68b44a69e7405a.json",
        "sha256": "9be08552f467c8b412ce1cf702122d35cfe8e78a42e028c4ac804db15bc1ae6f",
        "media_type": "application/json"
      }
    },
    {
      "snapshot_id": "48f9d690d7f3dc334005fa4132f60975e892d9a87d56ace25848f8cfc77cc4c8",
      "generated_at": "2026-09-14T13:18:21.432922Z",
      "workload": {
        "id": "aider-polyglot",
        "version": "cb6a152e5ee27fbc77ac499d5e628ccd74a5fa2a",
        "unit": "polyglot_case"
      },
      "config_hash": "7b3ff2c4f66ac84753c961056c6f8917b15835c79edcd2f43f49f89dbb2f6699",
      "catalog_hash": "758592afd563c4b6b96785c90ba9fb0e612f2f3a857c50f75ff01c55d122db2e",
      "axis_hash": "ec2d64c575c9deda9612834010ee200271e725ca6ee0114f6d5e068efcc5d254",
      "view_hash": "437cb850f8b421392fb44219fd13427d1ebe874fe1d96321f3e4401174bc134f",
      "snapshot": {
        "path": "frontiers/total-cost-vs-solve-rate/48f9d690d7f3dc334005fa4132f60975e892d9a87d56ace25848f8cfc77cc4c8.json",
        "sha256": "f4207c248a6f516ee2fc8bfeeba9c7159297298f56d576a0ebde8819ae8c8f49",
        "media_type": "application/json"
      }
    },
    {
      "snapshot_id": "c40228a9119018c319ad5c8c858b19d2b60c60c8993518d07fcfd50264c6fbe0",
      "generated_at": "2026-09-07T12:59:34.782935Z",
      "workload": {
        "id": "aider-polyglot",
        "version": "cb6a152e5ee27fbc77ac499d5e628ccd74a5fa2a",
        "unit": "polyglot_case"
      },
      "config_hash": "bf1d20ec5d22f01da83920958104a5aef3fc5bf42bf65a8bc1bdb0e402d61d6e",
      "catalog_hash": "44262ff832ea467d68b717324fa775e450dec64dfff0be0b63722dd0df46c5e9",
      "axis_hash": "ec2d64c575c9deda9612834010ee200271e725ca6ee0114f6d5e068efcc5d254",
      "view_hash": "437cb850f8b421392fb44219fd13427d1ebe874fe1d96321f3e4401174bc134f",
      "snapshot": {
        "path": "frontiers/total-cost-vs-solve-rate/c40228a9119018c319ad5c8c858b19d2b60c60c8993518d07fcfd50264c6fbe0.json",
        "sha256": "7a0aecc0ed7685266deb55080485393f8cb34a1f819283754aa2dfd96cb2b20e",
        "media_type": "application/json"
      }
    },
    {
      "snapshot_id": "36d486fe5ad54b9e95a842e60c71d91faf55665065c3aaec13c5008492bf0b5f",
      "generated_at": "2026-08-31T14:23:44.716403Z",
      "workload": {
        "id": "aider-polyglot",
        "version": "cb6a152e5ee27fbc77ac499d5e628ccd74a5fa2a",
        "unit": "polyglot_case"
      },
      "config_hash": "bf1d20ec5d22f01da83920958104a5aef3fc5bf42bf65a8bc1bdb0e402d61d6e",
      "catalog_hash": "b9134676acce7c90e62cdcad0822100b240d8129eaf2999732c0e872d8d20582",
      "axis_hash": "ec2d64c575c9deda9612834010ee200271e725ca6ee0114f6d5e068efcc5d254",
      "view_hash": "437cb850f8b421392fb44219fd13427d1ebe874fe1d96321f3e4401174bc134f",
      "snapshot": {
        "path": "frontiers/total-cost-vs-solve-rate/36d486fe5ad54b9e95a842e60c71d91faf55665065c3aaec13c5008492bf0b5f.json",
        "sha256": "0173eb5d811f89bd59f63da67fa193b885a76787391c06229d5d5cfb6c913cda",
        "media_type": "application/json"
      }
    },
    {
      "snapshot_id": "9c12523214633e9345183143493970ed111b9d06d993ec15f69833142c6aba52",
      "generated_at": "2026-08-30T23:22:23.448015Z",
      "workload": {
        "id": "aider-polyglot",
        "version": "cb6a152e5ee27fbc77ac499d5e628ccd74a5fa2a",
        "unit": "polyglot_case"
      },
      "config_hash": "bf1d20ec5d22f01da83920958104a5aef3fc5bf42bf65a8bc1bdb0e402d61d6e",
      "catalog_hash": "0a844cd1e898788593e656d192737f93991d1d1af5930dd99f333e867bf677d9",
      "axis_hash": "ec2d64c575c9deda9612834010ee200271e725ca6ee0114f6d5e068efcc5d254",
      "view_hash": "437cb850f8b421392fb44219fd13427d1ebe874fe1d96321f3e4401174bc134f",
      "snapshot": {
        "path": "frontiers/total-cost-vs-solve-rate/9c12523214633e9345183143493970ed111b9d06d993ec15f69833142c6aba52.json",
        "sha256": "69415240faa29767ef5a8264a8ea381e315ffad62659ce7876e417812680a994",
        "media_type": "application/json"
      }
    },
    {
      "snapshot_id": "f37335341460be30e535952fb36f7bd35bc9f1eb6ec3ff2fefa110337c2a7d31",
      "generated_at": "2026-08-30T20:07:07.296017Z",
      "workload": {
        "id": "aider-polyglot",
        "version": "cb6a152e5ee27fbc77ac499d5e628ccd74a5fa2a",
        "unit": "polyglot_case"
      },
      "config_hash": "bf1d20ec5d22f01da83920958104a5aef3fc5bf42bf65a8bc1bdb0e402d61d6e",
      "catalog_hash": "baf5b2f3316948fb27a91957d0a408216450f462f1ceb13218ece50c204f23f4",
      "axis_hash": "ec2d64c575c9deda9612834010ee200271e725ca6ee0114f6d5e068efcc5d254",
      "view_hash": "437cb850f8b421392fb44219fd13427d1ebe874fe1d96321f3e4401174bc134f",
      "snapshot": {
        "path": "frontiers/total-cost-vs-solve-rate/f37335341460be30e535952fb36f7bd35bc9f1eb6ec3ff2fefa110337c2a7d31.json",
        "sha256": "5f87d58f1dc00e3ea94e3b99ac7cd58dd7913005b4f1446eef6c390dadfa113b",
        "media_type": "application/json"
      }
    },
    {
      "snapshot_id": "6c49f8482804507e49453d9c157450bcf4f49818ea8a0ffe5b62d4d3e5b1046b",
      "generated_at": "2026-08-30T20:06:03.032248Z",
      "workload": {
        "id": "aider-polyglot",
        "version": "cb6a152e5ee27fbc77ac499d5e628ccd74a5fa2a",
        "unit": "polyglot_case"
      },
      "config_hash": "bf1d20ec5d22f01da83920958104a5aef3fc5bf42bf65a8bc1bdb0e402d61d6e",
      "catalog_hash": "0fe5d1ad120ac1eda1e26580ccb1ef678f7438b996bda89eb5952ba66644a599",
      "axis_hash": "ec2d64c575c9deda9612834010ee200271e725ca6ee0114f6d5e068efcc5d254",
      "view_hash": "437cb850f8b421392fb44219fd13427d1ebe874fe1d96321f3e4401174bc134f",
      "snapshot": {
        "path": "frontiers/total-cost-vs-solve-rate/6c49f8482804507e49453d9c157450bcf4f49818ea8a0ffe5b62d4d3e5b1046b.json",
        "sha256": "61648b6177d4b8a6beaa3f374b3f34c85c9044ceba30fcf53bfa516971e4e264",
        "media_type": "application/json"
      }
    },
    {
      "snapshot_id": "d6b31eadb6084d81d28c61b0f4e59c9d2f1dce7420a8118a96ba5a733fad274a",
      "generated_at": "2026-08-30T19:50:53.186275Z",
      "workload": {
        "id": "aider-polyglot",
        "version": "cb6a152e5ee27fbc77ac499d5e628ccd74a5fa2a",
        "unit": "polyglot_case"
      },
      "config_hash": "95f5cee19fc416ae76dba0d3095e604e67d332f0bf957f2db6f76f550546a38b",
      "catalog_hash": "06a10bf220a45d8e531cddb0eae638ea779f5091666b4f36a438086c37f8d845",
      "axis_hash": "ec2d64c575c9deda9612834010ee200271e725ca6ee0114f6d5e068efcc5d254",
      "view_hash": "437cb850f8b421392fb44219fd13427d1ebe874fe1d96321f3e4401174bc134f",
      "snapshot": {
        "path": "frontiers/total-cost-vs-solve-rate/d6b31eadb6084d81d28c61b0f4e59c9d2f1dce7420a8118a96ba5a733fad274a.json",
        "sha256": "c790ced118b28b3487d0249a7c149b85af597249a80aedfaa661ffa116773522",
        "media_type": "application/json"
      }
    },
    {
      "snapshot_id": "1aa0c56dd4ade6cb857abf1e820e88eb74b666afc766f1e57b3d40912507faf3",
      "generated_at": "2026-08-30T19:43:34.685832Z",
      "workload": {
        "id": "aider-polyglot",
        "version": "cb6a152e5ee27fbc77ac499d5e628ccd74a5fa2a",
        "unit": "polyglot_case"
      },
      "config_hash": "af1da4c7e51280667b5fbddc8bd6c3d8a092b58ab3f9acb1262001be62099075",
      "catalog_hash": "a6804744e2f3172e3f6b8dc9af10687d91f87ce866361811bf23bc075b7d2dd2",
      "axis_hash": "ec2d64c575c9deda9612834010ee200271e725ca6ee0114f6d5e068efcc5d254",
      "view_hash": "437cb850f8b421392fb44219fd13427d1ebe874fe1d96321f3e4401174bc134f",
      "snapshot": {
        "path": "frontiers/total-cost-vs-solve-rate/1aa0c56dd4ade6cb857abf1e820e88eb74b666afc766f1e57b3d40912507faf3.json",
        "sha256": "04c5c909594d90ab32a2b49d4ae067666eb05209f16b09f1ca9554390e6cda2b",
        "media_type": "application/json"
      }
    }
  ]
}
