{
  "schema_version": "model-skyline/v1alpha1",
  "kind": "frontier-history",
  "frontier_id": "price-snapshot-reconstructed-token-cost-vs-solve-rate",
  "entries": [
    {
      "snapshot_id": "8975c1a961f34413fe2675b58ef0d474f1965a1ad284939698da04cb3f0fe3ec",
      "generated_at": "2026-09-01T10:10:34.978754Z",
      "workload": {
        "id": "aider-polyglot",
        "version": "sha256:bb92c4555c1341c52f386c8c8b1ba7c5b3c56cec60a5f9129ecf8ee99a8cc2a8",
        "unit": "polyglot_case"
      },
      "config_hash": "f2f420537eba812f9ebc11b5824555c28b8127d8bddb7ab5062099c1bb3a5a2d",
      "catalog_hash": "3551a844f5292c228a58a72ad9c238e36347f45a7d49d0910f6e4c0484f3a2f5",
      "axis_hash": "d3b0637eb3c85e13ddb86a737ccbb3715dc3a8c666d08921b9ef8ff6287c57cd",
      "view_hash": "7a65673d671b271e4ffb72d6fbdb11c4c595b9a19be299766240c0f751828f9a",
      "snapshot": {
        "path": "frontiers/price-snapshot-reconstructed-token-cost-vs-solve-rate/8975c1a961f34413fe2675b58ef0d474f1965a1ad284939698da04cb3f0fe3ec.json",
        "sha256": "ef78a73acd8d9ddd952167034a8bc86e9e34765cad68616087a4332fc9f56d37",
        "media_type": "application/json"
      }
    }
  ]
}
